{
  "actions": [
    {
      "effort": "medium",
      "impact": "high",
      "rank": 1,
      "title": "Add tests around the top hotspots",
      "why": "The riskiest source paths have no direct static test evidence."
    },
    {
      "effort": "high",
      "impact": "medium",
      "rank": 2,
      "title": "Split high-complexity functions and add branch tests",
      "why": "Complex branching is the most expensive code to change safely."
    }
  ],
  "architecture": {
    "archetype": "library",
    "components": [
      "audio_filters",
      "backtracking",
      "bit_manipulation",
      "blockchain",
      "boolean_algebra",
      "cellular_automata",
      "ciphers",
      "computer_vision",
      "conversions",
      "data_compression",
      "data_structures",
      "digital_image_processing",
      "divide_and_conquer",
      "dynamic_programming",
      "electronics",
      "file_transfer",
      "financial",
      "fractals",
      "fuzzy_logic",
      "genetic_algorithm"
    ],
    "entry_points": [],
    "hotspots": [
      "data_structures/binary_tree/red_black_tree.py",
      "maths/primelib.py",
      "linear_algebra/src/polynom_for_points.py",
      "data_structures/heap/binomial_heap.py",
      "dynamic_programming/optimal_binary_search_tree.py"
    ]
  },
  "changes": {
    "added": 0,
    "deleted": 0,
    "modified": 0,
    "quality_delta": 0,
    "since_scan_id": 3
  },
  "dimensions": [
    {
      "assessed": true,
      "confidence": "low",
      "evidence": [],
      "grade": "A+?",
      "id": "architecture",
      "score": 100,
      "summary": "library; no clear entry point; 0 import cycle(s)."
    },
    {
      "assessed": true,
      "confidence": "low",
      "evidence": [
        "audio_filters/iir_filter.py",
        "backtracking/rat_in_maze.py",
        "boolean_algebra/quine_mc_cluskey.py"
      ],
      "grade": "D?",
      "id": "maintainability",
      "score": 63,
      "summary": "1571 source files; 17 over 500 lines; 4 TODOs; max complexity 31; 90 parse error(s)."
    },
    {
      "assessed": true,
      "confidence": "low",
      "evidence": [
        "data_structures/binary_tree/red_black_tree.py",
        "data_structures/heap/binomial_heap.py",
        "dynamic_programming/optimal_binary_search_tree.py"
      ],
      "grade": "D?",
      "id": "tests",
      "score": 68,
      "summary": "37 test files; ratio 0.02; 5 test-signal finding(s)."
    },
    {
      "assessed": true,
      "confidence": "low",
      "evidence": [],
      "grade": "A+?",
      "id": "docs",
      "score": 100,
      "summary": "0 canonical documentation finding(s); translations excluded from scoring."
    },
    {
      "assessed": true,
      "confidence": "low",
      "evidence": [
        "pyproject.toml"
      ],
      "grade": "A?",
      "id": "dependencies",
      "score": 94,
      "summary": "2 dependency/hygiene finding(s); no lockfile; 16 unpinned dependency string(s)."
    },
    {
      "assessed": true,
      "confidence": "low",
      "evidence": [],
      "grade": "A+?",
      "id": "security",
      "score": 100,
      "summary": "Basic pattern checks only; 0 secret-like match(es); 0 dynamic-execution and 0 debug finding(s)."
    }
  ],
  "exclusions": {
    "docs_translations": 0,
    "examples": 8,
    "generated": 0,
    "reason": "Documentation translations, examples, generated files and vendored code do not drive source quality.",
    "vendor": 0
  },
  "findings": [
    {
      "confidence": "high",
      "dimension": "maintainability",
      "evidence": [
        "f-string expression part cannot include a backslash (line 328)"
      ],
      "file": "conversions/endianness.py",
      "id": "MNT009:conversions/endianness.py",
      "line": 1,
      "recommendation": "Fix the syntax error and re-scan to restore full analysis coverage.",
      "rule_id": "MNT009",
      "severity": "high",
      "title": "Python parse error",
      "why": "A file that does not parse cannot be analysed or imported safely."
    },
    {
      "confidence": "high",
      "dimension": "maintainability",
      "evidence": [
        "dict unpacking cannot be used in dict comprehension (line 79)"
      ],
      "file": "data_compression/huffman.py",
      "id": "MNT009:data_compression/huffman.py",
      "line": 1,
      "recommendation": "Fix the syntax error and re-scan to restore full analysis coverage.",
      "rule_id": "MNT009",
      "severity": "high",
      "title": "Python parse error",
      "why": "A file that does not parse cannot be analysed or imported safely."
    },
    {
      "confidence": "high",
      "dimension": "maintainability",
      "evidence": [
        "iterable unpacking cannot be used in comprehension (line 41)"
      ],
      "file": "data_structures/arrays/sudoku_solver.py",
      "id": "MNT009:data_structures/arrays/sudoku_solver.py",
      "line": 1,
      "recommendation": "Fix the syntax error and re-scan to restore full analysis coverage.",
      "rule_id": "MNT009",
      "severity": "high",
      "title": "Python parse error",
      "why": "A file that does not parse cannot be analysed or imported safely."
    },
    {
      "confidence": "high",
      "dimension": "maintainability",
      "evidence": [
        "invalid syntax (line 47)"
      ],
      "file": "data_structures/binary_tree/non_recursive_segment_tree.py",
      "id": "MNT009:data_structures/binary_tree/non_recursive_segment_tree.py",
      "line": 1,
      "recommendation": "Fix the syntax error and re-scan to restore full analysis coverage.",
      "rule_id": "MNT009",
      "severity": "high",
      "title": "Python parse error",
      "why": "A file that does not parse cannot be analysed or imported safely."
    },
    {
      "confidence": "high",
      "dimension": "maintainability",
      "evidence": [
        "RedBlackTree._remove_repair at line 205",
        "72 lines",
        "complexity 31"
      ],
      "file": "data_structures/binary_tree/red_black_tree.py",
      "id": "MNT007:data_structures/binary_tree/red_black_tree.py",
      "line": 205,
      "recommendation": "Split the function by responsibility and add regression tests for each branch.",
      "rule_id": "MNT007",
      "severity": "high",
      "title": "Very high cyclomatic complexity",
      "why": "Very high branching complexity makes a function hard to test exhaustively."
    },
    {
      "confidence": "high",
      "dimension": "maintainability",
      "evidence": [
        "invalid syntax (line 20)"
      ],
      "file": "data_structures/hashing/hash_map.py",
      "id": "MNT009:data_structures/hashing/hash_map.py",
      "line": 1,
      "recommendation": "Fix the syntax error and re-scan to restore full analysis coverage.",
      "rule_id": "MNT009",
      "severity": "high",
      "title": "Python parse error",
      "why": "A file that does not parse cannot be analysed or imported safely."
    },
    {
      "confidence": "high",
      "dimension": "maintainability",
      "evidence": [
        "invalid syntax (line 14)"
      ],
      "file": "data_structures/heap/heap.py",
      "id": "MNT009:data_structures/heap/heap.py",
      "line": 1,
      "recommendation": "Fix the syntax error and re-scan to restore full analysis coverage.",
      "rule_id": "MNT009",
      "severity": "high",
      "title": "Python parse error",
      "why": "A file that does not parse cannot be analysed or imported safely."
    },
    {
      "confidence": "high",
      "dimension": "maintainability",
      "evidence": [
        "invalid syntax (line 12)"
      ],
      "file": "data_structures/heap/randomized_heap.py",
      "id": "MNT009:data_structures/heap/randomized_heap.py",
      "line": 1,
      "recommendation": "Fix the syntax error and re-scan to restore full analysis coverage.",
      "rule_id": "MNT009",
      "severity": "high",
      "title": "Python parse error",
      "why": "A file that does not parse cannot be analysed or imported safely."
    },
    {
      "confidence": "high",
      "dimension": "maintainability",
      "evidence": [
        "invalid syntax (line 11)"
      ],
      "file": "data_structures/heap/skew_heap.py",
      "id": "MNT009:data_structures/heap/skew_heap.py",
      "line": 1,
      "recommendation": "Fix the syntax error and re-scan to restore full analysis coverage.",
      "rule_id": "MNT009",
      "severity": "high",
      "title": "Python parse error",
      "why": "A file that does not parse cannot be analysed or imported safely."
    },
    {
      "confidence": "high",
      "dimension": "maintainability",
      "evidence": [
        "invalid syntax (line 19)"
      ],
      "file": "data_structures/linked_list/doubly_linked_list_two.py",
      "id": "MNT009:data_structures/linked_list/doubly_linked_list_two.py",
      "line": 1,
      "recommendation": "Fix the syntax error and re-scan to restore full analysis coverage.",
      "rule_id": "MNT009",
      "severity": "high",
      "title": "Python parse error",
      "why": "A file that does not parse cannot be analysed or imported safely."
    },
    {
      "confidence": "high",
      "dimension": "maintainability",
      "evidence": [
        "invalid syntax (line 16)"
      ],
      "file": "data_structures/linked_list/skip_list.py",
      "id": "MNT009:data_structures/linked_list/skip_list.py",
      "line": 1,
      "recommendation": "Fix the syntax error and re-scan to restore full analysis coverage.",
      "rule_id": "MNT009",
      "severity": "high",
      "title": "Python parse error",
      "why": "A file that does not parse cannot be analysed or imported safely."
    },
    {
      "confidence": "high",
      "dimension": "maintainability",
      "evidence": [
        "invalid syntax (line 6)"
      ],
      "file": "data_structures/queues/queue_by_list.py",
      "id": "MNT009:data_structures/queues/queue_by_list.py",
      "line": 1,